100043,Monster,1000042,达达淤泥怪,0,,当我发现变成淤泥怪的时候，我以为我绝对没人打扰了，没想到你还要来打我啊。,我很脏G，打我脏手的。而且我又没宝藏。,看来你是喜欢上看我说话啦。那我不说了。,。。。,。。。,100,诶呀，这张嘴就是管不住啊。,我感觉达达的巅峰时刻要来了，你等着。,我去，泥巴能这么强的吗？,哈，我可不是普通的泥巴。,"1,4;5,8;9,12;13,15;16,18;19,20;21,23;24,25",0,5000,,
100044,Monster,1000043,达达干尸,0,发现你了。,巅峰干尸，教你做人。,我达达又回来了。,虽然样子不咋地，不过肯定能打过你。,我这样子，就问你怕不怕。,你再打，我就摘下绷带吓死你哦。,100,啊，蓝瘦香菇。,我感觉我快放弃了。,达达，你这样真的好吓人啊，我跑了。,不准跑，给我打死一次呀。,"1,4;5,8;9,12;13,15;16,18;19,20;21,23;24,25",0,5000,,
100045,Monster,1000044,达达火人,0,,学会了元素攻击，我感觉我棒棒哒。,我达达火人可以烧尽万物，包括你这个家伙。,为什么呀，你为什么还敢打我啊。,是谁给你的勇气来挑战我达达火人。,我，我，我烧死你哦。,100,感觉火要灭了。,又死了，我好崩溃啊，为神马呀。,起火了，达达，给我当点火机吧。,想得美，我现在要把你点了。,"1,4;5,8;9,12;13,15;16,18;19,20;21,23;24,25",0,5000,,
100046,Monster,1000045,达达石头怪,0,,火人都打不过，我感觉我石头怪也有困难啊。,还好很肉，能抗久一点。,我们可以停战了吗？我感觉好像没机会了。,我还是会努力反击的。,砸你。,100,结束了吗?,这次我感觉自己真的要死掉了呀。,你终于赢过我了G。,总要赢一次的。,"1,4;5,8;9,12;13,15;16,18;19,20;21,23;24,25",0,5000,,
100047,Monster,1000046,达达雪人,0,最后一次了，我们能做朋友吗？,看来，还是要战啊。,那就来好好打一架吧。,我不会再放弃了，这就是我的宿命对决。,寒冰风暴，骗你的，哈哈。吃我一锤。,吃冰吧，菜鸟。,100,啊，终于，要走了吗？,G，人类，再见了，别再去找我那些副本麻烦了，虽然数据不断重生，但是我的心已经死掉了哦。,我让你的。,我信了，被我捶死吧，傻瓜。,"1,4;5,8;9,12;13,15;16,18;19,20;21,23;24,25",0,5000,,
100048,Monster,1000047,诗词鸡,0,静夜思,李白,窗前明月光,疑是地上霜,举头望明月,低头思故乡,100,想家了，送我走。,我回来了，故乡。,,,"1,4;5,8;9,12;13,15;16,18;19,20;21,23;24,25",0,5000,,
100049,Monster,1000048,编程鸭,0,会敲代码吗？兄N！,知道scratch吗？听过贝尔编程吗?,会用if else吗？,要好好学习编程啊，那是和未来沟通的语言来的。,想要理解人工智能，就要学编程。,想要战胜boss，还是要学编程。,100,要学编程啊，兄N。,记得学编程啊。,我学，我学还不行吗？,晚了。,"1,4;5,8;9,12;13,15;16,18;19,20;21,23;24,25",0,5000,,
100050,Monster,1000049,食物猪,0,保护食物，攻击敌人，冲鸭！,打死你坏蛋。,别想抢走我的食物。,都是我的。,滚蛋吧。坏人。,我是在帮助主人保护食物，绝对没有自己偷吃。,100,我错了，我不该偷吃的，对不起，主人。,我心爱的食物们，再见。,我就没想抢你的食物啊，你误会了兄弟。,信你才怪，受死。,"1,4;5,8;9,12;13,15;16,18;19,20;21,23;24,25",0,5000,,
100051,Monster,1000050,宝藏猪,0,哇 ，被看到就没办法了，干掉你。,果然，没有人能够逃过宝藏的吸引啊。,想要我的宝藏，要有命拿哦。,贪婪会让你死亡。,你不该觊觎我的宝藏。,你会血本无归。,100,哈，你以为我要死了吗？,好吧，我确实要死啦。随便吧。反正也不是我的宝藏。,我去，我不要宝藏啦。,为你的贪婪付出代价吧。,"1,4;5,8;9,12;13,15;16,18;19,20;21,23;24,25",0,5000,,
100052,Monster,1000051,公主猪,0,,我本是雪人部落的公主，不要打我，我可以给你荣华富贵。,不，我还要去找我的王子。,难道又要重生一次了吗？,我要反击你。,不准侵犯公主的威严。,100,要为我报仇啊，我的侍卫们。,你死定啦。,不愧是公主，打不过打不过。,给我趴下。,"1,4;5,8;9,12;13,15;16,18;19,20;21,23;24,25",0,5000,,
100053,Monster,1000052,英文狼,0,,If you want to learn English. Found me is ok !,好吧，其实我英文不好，别打我了。,你学不学。,好好学英语我就不咬你了。,"Try your best,boy！",100,I'm dying.,"Goodbye,My world.",英文其实我觉得还是很重要的。,是吧，不过你现在才知道有点晚了。,"1,4;5,8;9,12;13,15;16,18;19,20;21,23;24,25",0,5000,,
100054,Monster,1000053,数学羊,0,,你是公主派来抓我的吗？,你怎么知道我是火人部落的王子。,就因为我还和以前一样热爱数学吗？,我不会回去的，我们缘分已尽了，现在我只想研究数学。,这是一个很好的方程式：r = 1 -sinθ,100,希望下辈子我们能是同族。,我会在重生的数据流中遇见你吗？,被只羊怼了，好丢脸。,不是一只普通的羊哦，是数学羊。,"1,4;5,8;9,12;13,15;16,18;19,20;21,23;24,25",0,5000,,
200001,Object,3095005,白桦,0,,砍了我能掉点木材给你。,我的树干可以成为你遮风避雨的港湾，这让我感到幸福。,我要变得有用了吗？,你说我要是能感觉到痛怎么办？,刀斧加身，不惧反喜，说的就是我啊。,80,即将化为材料。,拿去用吧，不用谢我。,,,,0,5000,,
200002,Object,3095001,常青树,0,,爱护树木，人人有责，何况我还是棵大树。,别打我，我会变成树妖的，你怕不怕。,别打我了。,再大又有什么用，没有反击的手段就保护不了自己。,,100,我就要倒下了。,愿我的木材不被浪费。,,,,15,7000,,
300001,NPC,10131,法尔(成就芯),240,,我若没有成就，就没有人会爱我。,我爱诉说自己成就，逃避失败，按着长远目标过活。,我有一点点的自恋、自我膨胀。,我讨厌亲密，不想让别人了解自己太多。,其实没有谁能十全十美。,80,,,,,,0,30000,,
300002,NPC,10120,法尔(活泼芯),240,,呀呀，客人，你好呀。,呀呀，法尔好开心。,呀呀，我想吃大米饭了。,呀呀，你知道吗？我喜欢每一个人。,呀呀，我想去玩，去看看美丽的世界。,100,,,,,,5,30000,,
300003,NPC,10174,宝箱哥哥,240,,嘿，看到了吗？这有个宝箱呢。,哈喽，宝箱找你有事情啊。,朋友，等一等，我需要你的帮助。,嘿，看到了吗？这有个宝箱呢。,嘿，看到了吗？这有个宝箱呢。,100,,,,,,5,30000,,
300004,NPC,10175,麦浪稻草人,240,,我真是个悲惨的稻草人啊，谁来拯救我一下吧。,我真是个悲惨的稻草人啊，谁来拯救我一下吧。,我真是个悲惨的稻草人啊，谁来拯救我一下吧。,我真是个悲惨的稻草人啊，谁来拯救我一下吧。,我真是个悲惨的稻草人啊，谁来拯救我一下吧。,100,,,,,,5,30000,,
300005,NPC,10172,青草弟弟,240,,快来帮帮我吧，阳光都快没有啦。,快来帮帮我吧，阳光都快没有啦。,快来帮帮我吧，阳光都快没有啦。,快来帮帮我吧，阳光都快没有啦。,快来帮帮我吧，阳光都快没有啦。,100,,,,,,5,30000,,
300006,NPC,10173,大树爸爸,240,,我觉得我需要帮助，我的营养都被小偷偷走啦。,我觉得我需要帮助，我的营养都被小偷偷走啦。,我觉得我需要帮助，我的营养都被小偷偷走啦。,我觉得我需要帮助，我的营养都被小偷偷走啦。,我觉得我需要帮助，我的营养都被小偷偷走啦。,100,,,,,,5,30000,,
300007,NPC,10123,法尔(忠诚芯),240,,我若不顺从，就没有人会爱我。,忧虑会阻碍我前行！留意留意！,我会非常尽责的为您提供石碑的消息的。,,,100,,,,,,0,30000,,
300008,NPC,10126,法尔(领袖芯),240,,我若没有权力，就没有人会爱我。,爱命令，说话大声、有威严，报复心理、爱辩论，靠意志来掌管生活。,,,,100,,,,,,0,30000,,
300009,NPC,10129,法尔(和平芯),240,,希望世界和平，没有争端。,不断的斗争毫无意义，合作才能共赢。,重要的是怎么实现欲望与资源的良性循环。,我这个人很爱交朋友，你愿不愿意和我做朋友呢？,什么时候，任何人之前都能实现完全的信任呢？应该不可能吧。,100,,,,,,0,30000,,
300010,NPC,10134,法尔(助人芯),240,,我若不帮助人，就没有人会爱我。,请随时找我帮忙。,,,,100,,,,,,0,30000,,
300011,NPC,10137,法尔(完美芯),240,,我若不完美，就没有人会爱我。,perfect真的很重要。,嗯，我觉得我还不错。,,,100,,,,,,0,30000,,
300012,NPC,10138,法尔(智慧芯),240,,我若没有知识，就没有人会爱我。,知识就是力量。,学习永无止境！,,,100,,,,,,0,30000,,
300013,NPC,10140,法尔(艺术芯),240,,我若不是独特的，就没有人会爱我。,我觉得我独一无二，至少在思想上是的。,,,,100,,,,,,0,30000,,
300014,NPC,,,,,,,,,,,,,,,,,,,
300015,,,,,,,,,,,,,,,,,,,,
